{"artifact_digest":"sha256:ba2a7cdd3b3f5553967bd89b39937f62d4a575c3b9f6219307bd3a786cf73e1b","cases":[{"case_id":"case_41b224478eaf760e8144b1f6","keyword_renames":{"color":"fore_rgb"},"source_assertion_digest":"sha256:488a72202c5008152d90e703b8a581cae7d4ba135787aa8e50f0d0b820b979fd","source_only_keywords":["force_color"]},{"case_id":"case_50104f69f284b5628d90b029","keyword_renames":{"on_color":"back_rgb"},"source_assertion_digest":"sha256:df7c6994a9521e003a829b4c8b6c59f6b93abc810c8bd9d281482da945e37ba2","source_only_keywords":["force_color"]},{"case_id":"case_51e2ff6bc9802a1803fc55c9","keyword_renames":{"on_color":"back_rgb"},"source_assertion_digest":"sha256:df7c6994a9521e003a829b4c8b6c59f6b93abc810c8bd9d281482da945e37ba2","source_only_keywords":["force_color"]},{"case_id":"case_942019cec8bae1dea1bc3460","keyword_renames":{"on_color":"back_rgb"},"source_assertion_digest":"sha256:df7c6994a9521e003a829b4c8b6c59f6b93abc810c8bd9d281482da945e37ba2","source_only_keywords":["force_color"]},{"case_id":"case_a49a01cfad8d0af1e6973391","keyword_renames":{"color":"fore_rgb"},"source_assertion_digest":"sha256:488a72202c5008152d90e703b8a581cae7d4ba135787aa8e50f0d0b820b979fd","source_only_keywords":["force_color"]},{"case_id":"case_c231f71510e8045580409a5e","keyword_renames":{"color":"fore_rgb"},"source_assertion_digest":"sha256:488a72202c5008152d90e703b8a581cae7d4ba135787aa8e50f0d0b820b979fd","source_only_keywords":["force_color"]},{"case_id":"case_dcf911ff197a239a703abe4d","keyword_renames":{"color":"fore_rgb"},"source_assertion_digest":"sha256:488a72202c5008152d90e703b8a581cae7d4ba135787aa8e50f0d0b820b979fd","source_only_keywords":["force_color"]},{"case_id":"case_f16a157710addc6257cec33e","keyword_renames":{"on_color":"back_rgb"},"source_assertion_digest":"sha256:df7c6994a9521e003a829b4c8b6c59f6b93abc810c8bd9d281482da945e37ba2","source_only_keywords":["force_color"]}],"generator":"study-mapped-test.v1","map_id":"termcolor-colored-observation-v1","schema_version":"study-call-map.v1","source_digest":"sha256:7956cc68e5b683ffad18828440fed60470ad95d585bdbb7cfbfece53c5d24b4f","target_digest":"sha256:39b66bb8c5d056012247c8cf251a2eeb4f0e79dcd734517f6abc92a8283d0200"}